match_number,opponent,batter,runs,balls,fours,sixes,strike_rate,dismissal
2,Mumbai Indians,AM Rahane,67,40,3,5,167.5,c HH Pandya b SN Thakur
2,Mumbai Indians,FH Allen,37,17,6,2,217.65,c Tilak Varma b SN Thakur
2,Mumbai Indians,C Green,18,10,1,1,180.0,c SE Rutherford b SN Thakur
2,Mumbai Indians,A Raghuvanshi,51,29,6,2,175.86,c Tilak Varma b HH Pandya
2,Mumbai Indians,RK Singh,33,21,4,0,157.14,not out
2,Mumbai Indians,Ramandeep Singh,4,4,0,0,100.0,not out
6,Sunrisers Hyderabad,AM Rahane,8,10,0,0,80.0,c E Malinga b JD Unadkat
6,Sunrisers Hyderabad,FH Allen,28,7,4,2,400.0,c & b Harsh Dubey
6,Sunrisers Hyderabad,A Raghuvanshi,52,29,6,2,179.31,"run out (Shivang Kumar, E Malinga)"
6,Sunrisers Hyderabad,C Green,2,2,0,0,100.0,run out (E Malinga)
6,Sunrisers Hyderabad,RK Singh,35,25,4,1,140.0,c JD Unadkat b Nithish Kumar Reddy
6,Sunrisers Hyderabad,AS Roy,0,2,0,0,0.0,c & b Nithish Kumar Reddy
6,Sunrisers Hyderabad,Ramandeep Singh,10,9,1,0,111.11,c JD Unadkat b E Malinga
6,Sunrisers Hyderabad,SP Narine,12,4,0,2,300.0,c Aniket Verma b E Malinga
6,Sunrisers Hyderabad,Kartik Tyagi,5,5,1,0,100.0,c Ishan Kishan b JD Unadkat
6,Sunrisers Hyderabad,VG Arora,1,2,0,0,50.0,not out
6,Sunrisers Hyderabad,CV Varun,0,1,0,0,0.0,b JD Unadkat
12,Punjab Kings,AM Rahane,8,6,1,0,133.33,not out
12,Punjab Kings,FH Allen,6,7,1,0,85.71,c P Simran Singh b XC Bartlett
12,Punjab Kings,C Green,4,2,1,0,200.0,c P Simran Singh b XC Bartlett
12,Punjab Kings,A Raghuvanshi,7,7,0,0,100.0,not out
15,Lucknow Super Giants,AM Rahane,41,24,4,2,170.83,c Mohammed Shami b DS Rathi
15,Lucknow Super Giants,FH Allen,9,8,2,0,112.5,c DS Rathi b Prince Yadav
15,Lucknow Super Giants,A Raghuvanshi,45,33,5,2,136.36,c AK Markram b M Siddharth
15,Lucknow Super Giants,C Green,32,24,3,1,133.33,not out
15,Lucknow Super Giants,RK Singh,4,7,0,0,57.14,b Avesh Khan
15,Lucknow Super Giants,R Powell,39,24,4,2,162.5,not out
22,Chennai Super Kings,FH Allen,1,3,0,0,33.33,c S Dube b A Kamboj
22,Chennai Super Kings,SP Narine,24,17,2,2,141.18,c Gurjapneet Singh b KK Ahmed
22,Chennai Super Kings,AM Rahane,28,22,0,2,127.27,c RD Gaikwad b Noor Ahmad
22,Chennai Super Kings,A Raghuvanshi,27,19,3,1,142.11,c D Brevis b AJ Hosein
22,Chennai Super Kings,RK Singh,6,12,0,0,50.0,c S Dube b Noor Ahmad
22,Chennai Super Kings,C Green,0,1,0,0,0.0,b Noor Ahmad
22,Chennai Super Kings,R Powell,31,22,1,2,140.91,not out
22,Chennai Super Kings,Ramandeep Singh,35,23,4,1,152.17,c SN Khan b A Kamboj
22,Chennai Super Kings,AS Roy,1,1,0,0,100.0,not out
25,Gujarat Titans,TL Seifert,19,14,2,1,135.71,c GD Phillips b K Rabada
25,Gujarat Titans,AM Rahane,0,1,0,0,0.0,c K Rabada b Mohammed Siraj
25,Gujarat Titans,A Raghuvanshi,8,4,2,0,200.0,c JC Buttler b K Rabada
25,Gujarat Titans,C Green,79,55,7,4,143.64,c JC Buttler b Rashid Khan
25,Gujarat Titans,R Powell,27,20,2,2,135.0,c Mohammed Siraj b Ashok Sharma
25,Gujarat Titans,AS Roy,9,7,1,0,128.57,c JC Buttler b M Prasidh Krishna
25,Gujarat Titans,RK Singh,1,2,0,0,50.0,c JC Buttler b K Rabada
25,Gujarat Titans,Ramandeep Singh,17,8,2,1,212.5,c Mohammed Siraj b Ashok Sharma
25,Gujarat Titans,SP Narine,0,5,0,0,0.0,c GD Phillips b Mohammed Siraj
25,Gujarat Titans,Kartik Tyagi,6,4,0,1,150.0,"run out (M Prasidh Krishna, JC Buttler)"
25,Gujarat Titans,VG Arora,0,1,0,0,0.0,not out
28,Rajasthan Royals,TL Seifert,0,1,0,0,0.0,b JC Archer
28,Rajasthan Royals,AM Rahane,0,2,0,0,0.0,c Dhruv Jurel b N Burger
28,Rajasthan Royals,A Raghuvanshi,10,19,1,0,52.63,lbw b RA Jadeja
28,Rajasthan Royals,C Green,27,13,4,1,207.69,st Dhruv Jurel b Ravi Bishnoi
28,Rajasthan Royals,R Powell,23,20,2,1,115.0,c D Ferreira b RA Jadeja
28,Rajasthan Royals,RK Singh,53,34,5,2,155.88,not out
28,Rajasthan Royals,Ramandeep Singh,10,13,1,0,76.92,b Yash Raj Punja
28,Rajasthan Royals,AS Roy,29,16,1,2,181.25,not out
38,Lucknow Super Giants,AM Rahane,10,15,0,1,66.67,c AK Markram b Mohsin Khan
38,Lucknow Super Giants,TL Seifert,0,3,0,0,0.0,c MD Choudhary b Mohsin Khan
38,Lucknow Super Giants,A Raghuvanshi,9,8,1,0,112.5,obstructing the field
38,Lucknow Super Giants,C Green,34,21,0,3,161.9,c RR Pant b Mohsin Khan
38,Lucknow Super Giants,R Powell,1,4,0,0,25.0,c RR Pant b Mohsin Khan
38,Lucknow Super Giants,RK Singh,83,51,7,5,162.75,not out
38,Lucknow Super Giants,AS Roy,0,1,0,0,0.0,c A Badoni b Mohsin Khan
38,Lucknow Super Giants,Ramandeep Singh,6,11,0,0,54.55,c MR Marsh b GF Linde
38,Lucknow Super Giants,SP Narine,4,6,0,0,66.67,not out
