match_number,date,opponent,venue,overs,maidens,runs,wickets,economy,dots,wides,noballs
3,2023-04-01,Delhi Capitals,"Bharat Ratna Shri Atal Bihari Vajpayee Ekana Cricket Stadium, Lucknow",4.0,0,29,2,7.25,12,0,0
6,2023-04-03,Chennai Super Kings,"MA Chidambaram Stadium, Chepauk, Chennai",3.0,0,39,1,13.0,4,1,0
15,2023-04-10,Royal Challengers Bangalore,"M Chinnaswamy Stadium, Bengaluru",4.0,0,53,0,13.25,7,0,0
21,2023-04-15,Punjab Kings,"Bharat Ratna Shri Atal Bihari Vajpayee Ekana Cricket Stadium, Lucknow",3.0,0,24,0,8.0,8,1,0
26,2023-04-19,Rajasthan Royals,"Sawai Mansingh Stadium, Jaipur",4.0,0,25,3,6.25,11,0,0
30,2023-04-22,Gujarat Titans,"Bharat Ratna Shri Atal Bihari Vajpayee Ekana Cricket Stadium, Lucknow",3.0,0,21,0,7.0,6,0,0
38,2023-04-28,Punjab Kings,"Punjab Cricket Association IS Bindra Stadium, Mohali, Chandigarh",2.0,0,28,0,14.0,1,0,0
51,2023-05-07,Gujarat Titans,"Narendra Modi Stadium, Ahmedabad",4.0,0,34,1,8.5,7,0,0
58,2023-05-13,Sunrisers Hyderabad,"Rajiv Gandhi International Stadium, Uppal, Hyderabad",2.0,0,30,1,15.0,2,0,0
