match_number,date,opponent,venue,runs,balls,fours,sixes,strike_rate,dismissal,batting_position
23,2009-05-01,Kolkata Knight Riders,Buffalo Park,10,8,1,0,125.0,c CH Gayle b I Sharma,7
28,2009-05-03,Royal Challengers Bangalore,New Wanderers Stadium,0,1,0,0,0.0,c RV Uthappa b D du Preez,3
35,2009-05-08,Delhi Daredevils,Buffalo Park,12,12,2,0,100.0,c PJ Sangwan b R Bhatia,8
38,2009-05-10,Royal Challengers Bangalore,St George's Park,62,49,4,1,126.53,not out,3
42,2009-05-12,Kings XI Punjab,SuperSport Park,1,5,0,0,20.0,lbw b PP Chawla,3
45,2009-05-14,Rajasthan Royals,Kingsmead,3,7,0,0,42.86,c AS Raut b SK Warne,3
55,2009-05-21,Delhi Daredevils,SuperSport Park,56,41,5,2,136.59,c AB de Villiers b PJ Sangwan,5
