match_number,date,opponent,venue,runs,balls,fours,sixes,strike_rate,dismissal,batting_position
18,2025-04-05,Rajasthan Royals,"Maharaja Yadavindra Singh International Cricket Stadium, Mullanpur",3,6,0,0,50.0,c SO Hetmyer b M Theekshana,9
22,2025-04-08,Chennai Super Kings,"Maharaja Yadavindra Singh International Cricket Stadium, Mullanpur",34,19,2,2,178.95,not out,8
27,2025-04-12,Sunrisers Hyderabad,"Rajiv Gandhi International Stadium, Uppal, Hyderabad",5,5,0,0,100.0,not out,8
31,2025-04-15,Kolkata Knight Riders,"Maharaja Yadavindra Singh International Cricket Stadium, Mullanpur",1,2,0,0,50.0,b SP Narine,9
37,2025-04-20,Royal Challengers Bengaluru,"Maharaja Yadavindra Singh International Cricket Stadium, Mullanpur",25,20,0,2,125.0,not out,8
44,2025-04-26,Kolkata Knight Riders,"Eden Gardens, Kolkata",3,7,0,0,42.86,c VR Iyer b VG Arora,5
49,2025-04-30,Chennai Super Kings,"MA Chidambaram Stadium, Chepauk, Chennai",4,2,1,0,200.0,not out,8
66,2025-05-24,Delhi Capitals,"Sawai Mansingh Stadium, Jaipur",0,2,0,0,0.0,c T Stubbs b Mustafizur Rahman,9
