match_number,date,opponent,venue,runs,balls,fours,sixes,strike_rate,dismissal,batting_position
2,2026-03-29,Kolkata Knight Riders,"Wankhede Stadium, Mumbai",5,2,1,0,250.0,not out,6
8,2026-04-04,Delhi Capitals,"Arun Jaitley Stadium, Delhi",28,21,2,1,133.33,c T Stubbs b T Natarajan,6
13,2026-04-07,Rajasthan Royals,"Barsapara Cricket Stadium, Guwahati",25,13,3,1,192.31,c Ravi Bishnoi b N Burger,6
20,2026-04-12,Royal Challengers Bengaluru,"Wankhede Stadium, Mumbai",1,2,0,0,50.0,c RM Patidar b Rasikh Salam,7
24,2026-04-16,Punjab Kings,"Wankhede Stadium, Mumbai",50,31,3,3,161.29,c XC Bartlett b Shashank Singh,4
