match_number,date,opponent,venue,overs,maidens,runs,wickets,economy,dots,wides,noballs
4,2026-03-31,Gujarat Titans,"Maharaja Yadavindra Singh International Cricket Stadium, New Chandigarh",4.0,0,36,0,9.0,9,1,0
7,2026-04-03,Chennai Super Kings,"MA Chidambaram Stadium, Chepauk, Chennai",4.0,0,48,1,12.0,7,2,0
12,2026-04-06,Kolkata Knight Riders,"Eden Gardens, Kolkata",1.4,0,9,2,5.4,8,0,0
17,2026-04-11,Sunrisers Hyderabad,"Maharaja Yadavindra Singh International Cricket Stadium, New Chandigarh",4.0,0,42,1,10.5,4,0,1
24,2026-04-16,Mumbai Indians,"Wankhede Stadium, Mumbai",4.0,0,39,0,9.75,2,0,0
29,2026-04-19,Lucknow Super Giants,"Maharaja Yadavindra Singh International Cricket Stadium, New Chandigarh",4.0,0,54,0,13.5,6,2,0
35,2026-04-25,Delhi Capitals,"Arun Jaitley Stadium, Delhi",4.0,0,69,1,17.25,1,1,0
46,2026-05-03,Gujarat Titans,"Narendra Modi Stadium, Ahmedabad",4.0,0,38,0,9.5,8,1,0
