match_number,opponent,batter,runs,balls,fours,sixes,strike_rate,dismissal
4,Punjab Kings,B Sai Sudharsan,13,11,2,0,118.18,c SS Iyer b M Jansen
4,Punjab Kings,Shubman Gill,39,27,6,0,144.44,c C Connolly b YS Chahal
4,Punjab Kings,JC Buttler,38,33,3,2,115.15,c XC Bartlett b YS Chahal
4,Punjab Kings,GD Phillips,25,17,1,1,147.06,c M Jansen b Vijaykumar Vyshak
4,Punjab Kings,Washington Sundar,18,16,2,0,112.5,c Arshdeep Singh b Vijaykumar Vyshak
4,Punjab Kings,M Shahrukh Khan,4,6,0,0,66.67,c Arshdeep Singh b Vijaykumar Vyshak
4,Punjab Kings,R Tewatia,11,10,1,0,110.0,not out
4,Punjab Kings,Rashid Khan,0,1,0,0,0.0,not out
