match_number,opponent,batter,runs,balls,fours,sixes,strike_rate,dismissal
1,Royal Challengers Bengaluru,RD Gaikwad,15,15,3,0,100.0,c C Green b Yash Dayal
1,Royal Challengers Bengaluru,R Ravindra,37,15,3,3,246.67,c RM Patidar b KV Sharma
1,Royal Challengers Bengaluru,AM Rahane,27,19,0,2,142.11,c GJ Maxwell b C Green
1,Royal Challengers Bengaluru,DJ Mitchell,22,18,0,2,122.22,c RM Patidar b C Green
1,Royal Challengers Bengaluru,S Dube,34,28,4,1,121.43,not out
1,Royal Challengers Bengaluru,RA Jadeja,25,17,0,1,147.06,not out
7,Gujarat Titans,RD Gaikwad,46,36,5,1,127.78,c WP Saha b SH Johnson
7,Gujarat Titans,R Ravindra,46,20,6,3,230.0,st WP Saha b Rashid Khan
7,Gujarat Titans,AM Rahane,12,12,1,0,100.0,st WP Saha b R Sai Kishore
7,Gujarat Titans,S Dube,51,23,2,5,221.74,c V Shankar b Rashid Khan
7,Gujarat Titans,DJ Mitchell,24,20,2,0,120.0,not out
7,Gujarat Titans,Sameer Rizvi,14,6,0,2,233.33,c DA Miller b MM Sharma
7,Gujarat Titans,RA Jadeja,7,3,1,0,233.33,"run out (WP Saha, V Shankar)"
13,Delhi Capitals,RD Gaikwad,1,2,0,0,50.0,c RR Pant b KK Ahmed
13,Delhi Capitals,R Ravindra,2,12,0,0,16.67,c T Stubbs b KK Ahmed
13,Delhi Capitals,AM Rahane,45,30,5,2,150.0,c DA Warner b Mukesh Kumar
13,Delhi Capitals,DJ Mitchell,34,26,1,2,130.77,c & b AR Patel
13,Delhi Capitals,S Dube,18,17,1,0,105.88,c T Stubbs b Mukesh Kumar
13,Delhi Capitals,Sameer Rizvi,0,1,0,0,0.0,c KK Ahmed b Mukesh Kumar
13,Delhi Capitals,RA Jadeja,21,17,2,0,123.53,not out
13,Delhi Capitals,MS Dhoni,37,16,4,3,231.25,not out
18,Sunrisers Hyderabad,R Ravindra,12,9,2,0,133.33,c AK Markram b B Kumar
18,Sunrisers Hyderabad,RD Gaikwad,26,21,3,1,123.81,c Abdul Samad b Shahbaz Ahmed
18,Sunrisers Hyderabad,AM Rahane,35,30,2,1,116.67,c M Markande b JD Unadkat
18,Sunrisers Hyderabad,S Dube,45,24,2,4,187.5,c B Kumar b PJ Cummins
18,Sunrisers Hyderabad,RA Jadeja,31,23,4,0,134.78,not out
18,Sunrisers Hyderabad,DJ Mitchell,13,11,1,0,118.18,c Abdul Samad b T Natarajan
18,Sunrisers Hyderabad,MS Dhoni,1,2,0,0,50.0,not out
22,Kolkata Knight Riders,R Ravindra,15,8,3,0,187.5,c CV Varun b VG Arora
22,Kolkata Knight Riders,RD Gaikwad,67,58,9,0,115.52,not out
22,Kolkata Knight Riders,DJ Mitchell,25,19,1,1,131.58,b SP Narine
22,Kolkata Knight Riders,S Dube,28,18,1,3,155.56,b VG Arora
22,Kolkata Knight Riders,MS Dhoni,1,3,0,0,33.33,not out
29,Mumbai Indians,AM Rahane,5,8,1,0,62.5,c HH Pandya b G Coetzee
29,Mumbai Indians,R Ravindra,21,16,2,1,131.25,c Ishan Kishan b S Gopal
29,Mumbai Indians,RD Gaikwad,69,40,5,5,172.5,c Mohammad Nabi b HH Pandya
29,Mumbai Indians,S Dube,66,38,10,2,173.68,not out
29,Mumbai Indians,DJ Mitchell,17,14,1,0,121.43,c Mohammad Nabi b HH Pandya
29,Mumbai Indians,MS Dhoni,20,4,0,3,500.0,not out
34,Lucknow Super Giants,AM Rahane,36,24,5,1,150.0,b KH Pandya
34,Lucknow Super Giants,R Ravindra,0,1,0,0,0.0,b Mohsin Khan
34,Lucknow Super Giants,RD Gaikwad,17,13,1,0,130.77,c KL Rahul b Yash Thakur
34,Lucknow Super Giants,RA Jadeja,57,40,5,1,142.5,not out
34,Lucknow Super Giants,S Dube,3,8,0,0,37.5,c KL Rahul b MP Stoinis
34,Lucknow Super Giants,Sameer Rizvi,1,5,0,0,20.0,st KL Rahul b KH Pandya
34,Lucknow Super Giants,MM Ali,30,20,0,3,150.0,c A Badoni b Ravi Bishnoi
34,Lucknow Super Giants,MS Dhoni,28,9,3,2,311.11,not out
39,Lucknow Super Giants,AM Rahane,1,3,0,0,33.33,c KL Rahul b MJ Henry
39,Lucknow Super Giants,RD Gaikwad,108,60,12,3,180.0,not out
39,Lucknow Super Giants,DJ Mitchell,11,10,1,0,110.0,c DJ Hooda b Yash Thakur
39,Lucknow Super Giants,RA Jadeja,16,19,2,0,84.21,c KL Rahul b Mohsin Khan
39,Lucknow Super Giants,S Dube,66,27,3,7,244.44,"run out (Q de Kock, MP Stoinis)"
39,Lucknow Super Giants,MS Dhoni,4,1,1,0,400.0,not out
46,Sunrisers Hyderabad,AM Rahane,9,12,1,0,75.0,c Shahbaz Ahmed b B Kumar
46,Sunrisers Hyderabad,RD Gaikwad,98,54,10,3,181.48,c Nithish Kumar Reddy b T Natarajan
46,Sunrisers Hyderabad,DJ Mitchell,52,32,7,1,162.5,c Nithish Kumar Reddy b JD Unadkat
46,Sunrisers Hyderabad,S Dube,39,20,1,4,195.0,not out
46,Sunrisers Hyderabad,MS Dhoni,5,2,1,0,250.0,not out
49,Punjab Kings,AM Rahane,29,24,5,0,120.83,c RR Rossouw b Harpreet Brar
49,Punjab Kings,RD Gaikwad,62,48,5,2,129.17,b Arshdeep Singh
49,Punjab Kings,S Dube,0,1,0,0,0.0,lbw b Harpreet Brar
49,Punjab Kings,RA Jadeja,2,4,0,0,50.0,lbw b RD Chahar
49,Punjab Kings,Sameer Rizvi,21,23,1,0,91.3,c HV Patel b K Rabada
49,Punjab Kings,MM Ali,15,9,1,1,166.67,b RD Chahar
49,Punjab Kings,MS Dhoni,14,11,1,1,127.27,"run out (JM Sharma, HV Patel)"
49,Punjab Kings,DJ Mitchell,1,1,0,0,100.0,not out
53,Punjab Kings,AM Rahane,9,7,1,0,128.57,c K Rabada b Arshdeep Singh
53,Punjab Kings,RD Gaikwad,32,21,4,1,152.38,c JM Sharma b RD Chahar
53,Punjab Kings,DJ Mitchell,30,19,2,1,157.89,lbw b HV Patel
53,Punjab Kings,S Dube,0,1,0,0,0.0,c JM Sharma b RD Chahar
53,Punjab Kings,MM Ali,17,20,2,0,85.0,c JM Bairstow b SM Curran
53,Punjab Kings,RA Jadeja,43,26,3,2,165.38,c SM Curran b Arshdeep Singh
53,Punjab Kings,MJ Santner,11,11,1,0,100.0,c SM Curran b RD Chahar
53,Punjab Kings,SN Thakur,17,11,2,1,154.55,b HV Patel
53,Punjab Kings,MS Dhoni,0,1,0,0,0.0,b HV Patel
53,Punjab Kings,TU Deshpande,0,1,0,0,0.0,not out
53,Punjab Kings,RJ Gleeson,2,2,0,0,100.0,not out
59,Gujarat Titans,AM Rahane,1,5,0,0,20.0,c R Tewatia b S Sandeep Warrier
59,Gujarat Titans,R Ravindra,1,2,0,0,50.0,run out (DA Miller)
59,Gujarat Titans,RD Gaikwad,0,3,0,0,0.0,c Rashid Khan b UT Yadav
59,Gujarat Titans,DJ Mitchell,63,34,7,3,185.29,c M Shahrukh Khan b MM Sharma
59,Gujarat Titans,MM Ali,56,36,4,4,155.56,c Noor Ahmad b MM Sharma
59,Gujarat Titans,S Dube,21,13,2,1,161.54,c Noor Ahmad b MM Sharma
59,Gujarat Titans,RA Jadeja,18,10,2,1,180.0,c DA Miller b Rashid Khan
59,Gujarat Titans,MS Dhoni,26,11,1,3,236.36,not out
59,Gujarat Titans,MJ Santner,0,2,0,0,0.0,b Rashid Khan
59,Gujarat Titans,SN Thakur,3,4,0,0,75.0,not out
61,Rajasthan Royals,R Ravindra,27,18,1,2,150.0,c & b R Ashwin
61,Rajasthan Royals,RD Gaikwad,42,41,1,2,102.44,not out
61,Rajasthan Royals,DJ Mitchell,22,13,4,0,169.23,lbw b YS Chahal
61,Rajasthan Royals,MM Ali,10,13,0,0,76.92,c Avesh Khan b N Burger
61,Rajasthan Royals,S Dube,18,11,2,1,163.64,c R Parag b R Ashwin
61,Rajasthan Royals,RA Jadeja,5,6,0,0,83.33,obstructing the field
61,Rajasthan Royals,Sameer Rizvi,15,8,3,0,187.5,not out
68,Royal Challengers Bengaluru,RD Gaikwad,0,1,0,0,0.0,c Yash Dayal b GJ Maxwell
68,Royal Challengers Bengaluru,R Ravindra,61,37,5,3,164.86,"run out (Swapnil Singh, KD Karthik)"
68,Royal Challengers Bengaluru,DJ Mitchell,4,6,0,0,66.67,c V Kohli b Yash Dayal
68,Royal Challengers Bengaluru,AM Rahane,33,22,3,1,150.0,c F du Plessis b LH Ferguson
68,Royal Challengers Bengaluru,S Dube,7,15,0,0,46.67,c LH Ferguson b C Green
68,Royal Challengers Bengaluru,RA Jadeja,42,22,3,3,190.91,not out
68,Royal Challengers Bengaluru,MJ Santner,3,4,0,0,75.0,c F du Plessis b Mohammed Siraj
68,Royal Challengers Bengaluru,MS Dhoni,25,13,3,1,192.31,c Swapnil Singh b Yash Dayal
68,Royal Challengers Bengaluru,SN Thakur,1,2,0,0,50.0,not out
